{
  "compatibility_policy": "closed-record-schemas-require-new-version-for-shape-changes",
  "contract_set_version": "propertyscope.product-contract-set.v1",
  "contracts": [
    {
      "builder_key": "property-snapshot",
      "builder_version": "3.0.0",
      "content_encoding": "gzip",
      "media_type": "application/x-ndjson",
      "record_framing": "one-json-object-per-line",
      "schema_path": "property-snapshot.v2.schema.json",
      "schema_version": "propertyscope.property-snapshot.v2",
      "target_feature": "feature-1"
    },
    {
      "builder_key": "property-sales",
      "builder_version": "4.0.0",
      "content_encoding": "gzip",
      "media_type": "application/x-ndjson",
      "record_framing": "one-json-object-per-line",
      "schema_path": "property-sales.v3.schema.json",
      "schema_version": "propertyscope.property-sales.v3",
      "target_feature": "feature-2"
    },
    {
      "builder_key": "crime-series",
      "builder_version": "3.0.0",
      "content_encoding": "gzip",
      "media_type": "application/x-ndjson",
      "record_framing": "one-json-object-per-line",
      "schema_path": "crime-series.v2.schema.json",
      "schema_version": "propertyscope.crime-series.v2",
      "target_feature": "feature-3"
    },
    {
      "builder_key": "school-points",
      "builder_version": "3.0.0",
      "content_encoding": "gzip",
      "media_type": "application/x-ndjson",
      "record_framing": "one-json-object-per-line",
      "schema_path": "school-points.v2.schema.json",
      "schema_version": "propertyscope.school-points.v2",
      "target_feature": "feature-3"
    }
  ],
  "legacy_contracts": [
    {
      "compatibility_status": "accepted-release-read-only",
      "schema_path": "property-snapshot.v1.schema.json",
      "schema_version": "propertyscope.property-snapshot.v1"
    },
    {
      "compatibility_status": "accepted-release-read-only",
      "schema_path": "property-sales.v2.schema.json",
      "schema_version": "propertyscope.property-sales.v2"
    },
    {
      "compatibility_status": "accepted-release-read-only",
      "schema_path": "crime-series.v1.schema.json",
      "schema_version": "propertyscope.crime-series.v1"
    },
    {
      "compatibility_status": "accepted-release-read-only",
      "schema_path": "school-points.v1.schema.json",
      "schema_version": "propertyscope.school-points.v1"
    }
  ]
}
